{"schemaVersion":2,"catalogId":"syuantsai-agent-skills","catalogSha256":"54c5e6ac9e7c573b5dcf289275c76890ecb109b801f7ddc8ac6e34531b1086d8","sources":[{"id":"atlassian-ecosystem","repository":"https://github.com/SyuanTsai/Skill-Atlassian-Ecosystem.git","requestedRef":"main","requestedRefType":"branch","resolvedCommit":"a25fd9fe97c35d2a1ee80bf832cae793784c34ce","resolvedVersion":"main@a25fd9fe","archiveSha256":"23d2fd46ef48cf91050a1e12ca9fe2beced4be5d7f8d322675f6559181ce62eb"},{"id":"code-collaboration","repository":"https://github.com/SyuanTsai/Skill-Code-Collaboration.git","requestedRef":"main","requestedRefType":"branch","resolvedCommit":"3af2fbf562120a6098b91197ec17e2607d162896","resolvedVersion":"main@3af2fbf5","archiveSha256":"68cff08e7377e334b9a5767ddf1db92103575463387dc0ae2fc618de80b3c9ce"},{"id":"general","repository":"https://github.com/SyuanTsai/Skill-General.git","requestedRef":"main","requestedRefType":"branch","resolvedCommit":"5f642e2ebe219cd1c74222a9f4ed88548518efbe","resolvedVersion":"main@5f642e2e","archiveSha256":"996b46489ab76d3430b704031df7588663587d22ff0ce5f4058a02c9e921845f"},{"id":"knowledge-content","repository":"https://github.com/SyuanTsai/Skill-Knowledge-Content.git","requestedRef":"main","requestedRefType":"branch","resolvedCommit":"645390635c2cead49b79f864031f8b7ee3b6b3d2","resolvedVersion":"main@64539063","archiveSha256":"099ac746e32f5970292ab326ce3381c6ed021ffb1f143b7a3297b5287e328c00"}],"skills":[{"id":"capture-private-course-knowledge","sourceId":"knowledge-content","sourcePath":"skills/capture-private-course-knowledge","contentSha256":"d4536f51118a3a7b7deaddc5f6a27f744079bc9b817b4e0d44287c272c778d12","targetPath":".agents/skills/capture-private-course-knowledge"},{"id":"configure-bitbucket-api-access","sourceId":"atlassian-ecosystem","sourcePath":"skills/configure-bitbucket-api-access","contentSha256":"63528fce116d1738707eed4b5d72c1b5c29c9ab0f37a6e9b652382cfd93666c1","targetPath":".agents/skills/configure-bitbucket-api-access"},{"id":"configure-confluence-api-access","sourceId":"atlassian-ecosystem","sourcePath":"skills/configure-confluence-api-access","contentSha256":"673843f937fadf67bf9ca00452beafb8bcfb8dcef8827740c2d39530e3578309","targetPath":".agents/skills/configure-confluence-api-access"},{"id":"configure-jira-api-access","sourceId":"atlassian-ecosystem","sourcePath":"skills/configure-jira-api-access","contentSha256":"c6ba896616be6c0741b57000634190ce4972fa642505844345a4800f06521c6f","targetPath":".agents/skills/configure-jira-api-access"},{"id":"investigate-datadog-logs","sourceId":"general","sourcePath":"skills/investigate-datadog-logs","contentSha256":"5106468246d46f3cddf7659328b231628e4f9e8a65d9dd124c251693d7a64a20","targetPath":".agents/skills/investigate-datadog-logs"},{"id":"manage-ai-memory","sourceId":"general","sourcePath":"skills/manage-ai-memory","contentSha256":"d74d09ba3bbfd4e14c24efd2fbb74c12e72bb264b5da0c4dcb2a2994deb57469","targetPath":".agents/skills/manage-ai-memory"},{"id":"manage-confluence-docs-as-code","sourceId":"atlassian-ecosystem","sourcePath":"skills/manage-confluence-docs-as-code","contentSha256":"a01681ef9b148c688cd70095868338bfbdb2eccdea57b71b1616510d9a3704be","targetPath":".agents/skills/manage-confluence-docs-as-code"},{"id":"manage-task-handoff","sourceId":"general","sourcePath":"skills/manage-task-handoff","contentSha256":"8eb084d0b084ba5a05942af43557bfb48a63fef4d8789e37fd1aa927125801da","targetPath":".agents/skills/manage-task-handoff"},{"id":"operate-environment-authorized-sql","sourceId":"general","sourcePath":"skills/operate-environment-authorized-sql","contentSha256":"fc42634cb9baa7048841db48aecfe1cb7ac1c6894adf919f575ff7ab877ac703","targetPath":".agents/skills/operate-environment-authorized-sql"},{"id":"plan-production-change","sourceId":"general","sourcePath":"skills/plan-production-change","contentSha256":"4c9d68204740ccf9611264a11c12273abe2097bdd6d15fc5e5734a91113db127","targetPath":".agents/skills/plan-production-change"},{"id":"publish-requirements-to-confluence","sourceId":"atlassian-ecosystem","sourcePath":"skills/publish-requirements-to-confluence","contentSha256":"041b8467716870020d29b0b8a5d7248b332ce6517ddbf9a7351296fcc802db11","targetPath":".agents/skills/publish-requirements-to-confluence"},{"id":"review-bitbucket-pull-request","sourceId":"atlassian-ecosystem","sourcePath":"skills/review-bitbucket-pull-request","contentSha256":"65795130cdb993d6a3d58a39ca9d21846c776849065648d1fe906780a21536f0","targetPath":".agents/skills/review-bitbucket-pull-request"},{"id":"verify-data-access-performance","sourceId":"general","sourcePath":"skills/verify-data-access-performance","contentSha256":"c8f98be1e36dda53ef49d0bb5da74dce6061bc51ae70c3388a27654ad7c4a84c","targetPath":".agents/skills/verify-data-access-performance"},{"id":"work-with-jira","sourceId":"atlassian-ecosystem","sourcePath":"skills/work-with-jira","contentSha256":"5d9351cbac9c4e8afdfa8a6513c0c5b9e9f223eb015ae8687563634fa78eff08","targetPath":".agents/skills/work-with-jira"},{"id":"write-copilot-implementation-prompt","sourceId":"code-collaboration","sourcePath":"skills/write-copilot-implementation-prompt","contentSha256":"139fbee6f5d6a09cc81e5dea51c6d2e025bccd0e2afc7b4b974ddbe5c02b227f","targetPath":".agents/skills/write-copilot-implementation-prompt"}]}
